{
  "expectedUserId": "user_role_request",
  "expectedWorkspaceId": "workspace_personal_role_request",
  "requestedRole": "doctor",
  "accountType": "doctor",
  "workspaceType": "clinic",
  "organizationId": "workspace_alpha",
  "name": "Bác sĩ An",
  "phone": "0912345678",
  "license": "CCHN-2026-001",
  "hospital": "Phòng khám An Khang",
  "department": "Tim mạch",
  "registrationReason": "Theo dõi bệnh nhân từ xa"
}
